{
  "contract_set_version": "1.0.0",
  "pipeline_version": "stage1-edge-v0.1",
  "document_id": "inv_003",
  "source_type": "pdf",
  "source_file": "source.pdf",
  "page_count": 1,
  "pages": [
    {
      "page_number": 1,
      "width": 2550,
      "height": 3300,
      "rotation_detected": 0,
      "blocks": [
        {
          "block_id": "p1_b1",
          "block_type": "text",
          "bbox": [100, 100, 2400, 200],
          "reading_order": 1,
          "text": "orders@example.com or call (212) 555-0100",
          "confidence": 0.9
        },
        {
          "block_id": "p1_b2",
          "block_type": "text",
          "bbox": [100, 220, 2400, 320],
          "reading_order": 2,
          "text": "Visit https://example.com | orders@example.com also 646-555-0199",
          "confidence": 0.91
        }
      ],
      "raw_ocr_lines": [
        {
          "line_id": "p1_l1",
          "bbox": [100, 100, 2400, 200],
          "text": "orders@example.com or call (212) 555-0100",
          "confidence": 0.9
        },
        {
          "line_id": "p1_l2",
          "bbox": [100, 220, 2400, 320],
          "text": "Visit https://example.com | orders@example.com also 646-555-0199",
          "confidence": 0.91
        }
      ]
    }
  ],
  "document_text": "orders@example.com or call (212) 555-0100\nVisit https://example.com | orders@example.com also 646-555-0199",
  "tables": [],
  "quality": {
    "scan_quality": "good",
    "skew_detected": false,
    "noise_level": "low"
  },
  "ingestion_sources": {
    "paddleocr_vl": { "enabled": true, "status": "success" },
    "falcon_ocr": { "enabled": false, "status": "not_implemented" },
    "falcon_perception": { "enabled": false, "status": "not_implemented" }
  },
  "warnings": []
}
