{
  "contract_set_version": "1.2.0",
  "pipeline_version": "0.1.0",
  "document_id": "inv_001_easy",
  "source_type": "pdf",
  "source_file": "source.pdf",
  "page_count": 1,
  "pages": [
    {
      "page_number": 1,
      "width": 850,
      "height": 1100,
      "rotation_detected": 0,
      "blocks": [
        {
          "block_id": "p1_b1",
          "block_type": "text",
          "bbox": [
            0,
            0,
            100,
            20
          ],
          "reading_order": 1,
          "text": "stub block",
          "confidence": 0.9
        }
      ],
      "raw_ocr_lines": [
        {
          "line_id": "p1_l1",
          "bbox": [
            0,
            0,
            100,
            20
          ],
          "text": "stub block",
          "confidence": 0.9
        }
      ]
    }
  ],
  "document_text": "stub block",
  "tables": [],
  "quality": {
    "scan_quality": "good",
    "skew_detected": false,
    "noise_level": "low"
  },
  "ingestion_sources": {
    "paddleocr_vl": {
      "enabled": false,
      "status": "not_implemented"
    },
    "falcon_ocr": {
      "enabled": false,
      "status": "not_implemented"
    },
    "falcon_perception": {
      "enabled": false,
      "status": "not_implemented"
    }
  },
  "warnings": []
}