{
  "contract_set_version": "1.0.0",
  "pipeline_version": "stage1-edge-v0.1",
  "document_id": "inv_002",
  "source_type": "pdf",
  "source_file": "source.pdf",
  "page_count": 2,
  "pages": [
    {
      "page_number": 1,
      "width": 2550,
      "height": 3300,
      "rotation_detected": 0,
      "blocks": [
        {
          "block_id": "p1_b1",
          "block_type": "text",
          "bbox": [100, 100, 2400, 200],
          "reading_order": 1,
          "text": "Contact: accounts@acme.com or visit https://acme.example.com/pay.",
          "confidence": 0.93
        },
        {
          "block_id": "p1_b2",
          "block_type": "text",
          "bbox": [100, 220, 2400, 320],
          "reading_order": 2,
          "text": "Phone (555) 123-4567. EIN 12-3456789.",
          "confidence": 0.92
        }
      ],
      "raw_ocr_lines": [
        {
          "line_id": "p1_l1",
          "bbox": [100, 100, 2400, 200],
          "text": "Contact: accounts@acme.com or visit https://acme.example.com/pay.",
          "confidence": 0.93
        },
        {
          "line_id": "p1_l2",
          "bbox": [100, 220, 2400, 320],
          "text": "Phone (555) 123-4567. EIN 12-3456789.",
          "confidence": 0.92
        }
      ]
    },
    {
      "page_number": 2,
      "width": 2550,
      "height": 3300,
      "rotation_detected": 0,
      "blocks": [
        {
          "block_id": "p2_b1",
          "block_type": "text",
          "bbox": [100, 100, 2400, 200],
          "reading_order": 1,
          "text": "Email: billing@example.org",
          "confidence": 0.9
        },
        {
          "block_id": "p2_b2",
          "block_type": "text",
          "bbox": [100, 220, 2400, 320],
          "reading_order": 2,
          "text": "Call 800-555-0100 for support",
          "confidence": 0.88
        }
      ],
      "raw_ocr_lines": [
        {
          "line_id": "p2_l1",
          "bbox": [100, 100, 2400, 200],
          "text": "Email: billing@example.org",
          "confidence": 0.9
        },
        {
          "line_id": "p2_l2",
          "bbox": [100, 220, 2400, 320],
          "text": "Call 800-555-0100 for support",
          "confidence": 0.88
        }
      ]
    }
  ],
  "document_text": "Contact: accounts@acme.com or visit https://acme.example.com/pay.\nPhone (555) 123-4567. EIN 12-3456789.\n\nEmail: billing@example.org\nCall 800-555-0100 for support",
  "tables": [],
  "quality": {
    "scan_quality": "good",
    "skew_detected": false,
    "noise_level": "low"
  },
  "ingestion_sources": {
    "paddleocr_vl": { "enabled": true, "status": "success" },
    "falcon_ocr": { "enabled": false, "status": "not_implemented" },
    "falcon_perception": { "enabled": false, "status": "not_implemented" }
  },
  "warnings": []
}
